MMM,"[<section class=""quote-sub-section Mt(30px)"" data-reactid=""214""><h2 class=""Fz(m) Lh(1) Fw(b) Mt(0) Mb(18px)"" data-reactid=""215""><span data-reactid=""216"">Description</span></h2><p class=""Mt(15px) Lh(1.6)"" data-reactid=""217"">3M Company develops, manufactures, and markets various products worldwide. It operates through four business segments: Safety and Industrial, Transportation and Electronics, Health Care, and Consumer. The Safety and Industrial segment offers personal safety products, industrial adhesives and tapes, abrasives, closure and masking systems, electrical markets, automotive aftermarket, and roofing granules to industrial, electrical, and safety markets. The Transportation and Electronics provides electronics, such as display materials and systems, electronic materials solutions; automotive and aerospace, and commercial solutions; advanced materials; and transportation safety products to transportation and electronic original equipment manufacturer customers. The Health Care segment offers medical and surgical supplies, skin health and infection prevention products, oral care, separation and purification sciences, health information systems, drug delivery systems, and food safety products to healthcare industry. The Consumer segment provides home improvement, home care, and consumer health care products, as well as stationery and office supplies to various consumers. This segment is also involved in the retail auto care business. It offers its products through various e-commerce and traditional wholesalers, retailers, jobbers, distributors, and dealers, as well as directly to users. 3M Company has a strategic collaboration with Merry Maids in residential cleaning sector; and collaborations with The Infectious Disease Research Institute and Duke Human Vaccine Institute to create a vaccine candidate with potential to provide protection against multiple variants of SARS-CoV-2. The company was founded in 1902 and is headquartered in St. Paul, Minnesota.</p></section>]"
AOS,"[<section class=""quote-sub-section Mt(30px)"" data-reactid=""216""><h2 class=""Fz(m) Lh(1) Fw(b) Mt(0) Mb(18px)"" data-reactid=""217""><span data-reactid=""218"">Description</span></h2><p class=""Mt(15px) Lh(1.6)"" data-reactid=""219"">A. O. Smith Corporation manufactures and markets residential and commercial gas and electric water heaters, boilers, tanks, and water treatment products in North America, China, Europe, and India. It operates through two segments, North America and Rest of World. The company offers water heaters for residences, restaurants, hotels and motels, office buildings, laundries, car washes, and small businesses; residential and commercial boilers for space heating applications in hospitals, schools, hotels, and other commercial buildings; and water treatment products, including on-the-go filtration bottles, point-of-use carbon and reverse osmosis products, point-of-entry water softeners, and whole-home water filtration products for residences, restaurants, hotels, and offices. It also provides food and beverage filtration products; expansion tanks, commercial solar water heating systems, swimming pool and spa heaters, and related products and parts; and heat pumps, combi-boilers, solar tank units, and air purification products. The company offers its products primarily under the A. O. Smith, State, Lochinvar, and water softener brands. It distributes its products through independent wholesale plumbing distributors, as well as through retail channels consisting of hardware and home center chains, and manufacturer representative firms; and offers Aquasana branded products directly to consumers through e-commerce, as well as other online retailers. The company was founded in 1874 and is headquartered in Milwaukee, Wisconsin.</p></section>]"
ABT,"[<section class=""quote-sub-section Mt(30px)"" data-reactid=""216""><h2 class=""Fz(m) Lh(1) Fw(b) Mt(0) Mb(18px)"" data-reactid=""217""><span data-reactid=""218"">Description</span></h2><p class=""Mt(15px) Lh(1.6)"" data-reactid=""219"">Abbott Laboratories discovers, develops, manufactures, and sells health care products worldwide. It operates in four segments: Established Pharmaceutical Products, Diagnostic Products, Nutritional Products, and Medical Devices. The Established Pharmaceutical Products segment provides generic pharmaceuticals for the treatment of pancreatic exocrine insufficiency, irritable bowel syndrome or biliary spasm, intrahepatic cholestasis or depressive symptoms, gynecological disorder, hormone replacement therapy, dyslipidemia, hypertension, hypothyroidism, Ménière's disease and vestibular vertigo, pain, fever, inflammation, and migraine, as well as provides anti-infective clarithromycin, influenza vaccine, and products to regulate physiological rhythm of the colon. The Diagnostic Products segment offers laboratory systems in the areas of immunoassay, clinical chemistry, hematology, and transfusion; molecular diagnostics systems that automate the extraction, purification, and preparation of DNA and RNA from patient samples, as well as detect and measure infectious agents; point of care systems; cartridges for testing blood; rapid diagnostics lateral flow testing products; molecular point-of-care testing for HIV, SARS-CoV-2, influenza A and B, RSV, and strep A; cardiometabolic test systems; drug and alcohol test, and remote patient monitoring and consumer self-test systems; and informatics and automation solutions for use in laboratories. The Nutritional Products segment provides pediatric and adult nutritional products. The Medical Devices segment offers rhythm management, electrophysiology, heart failure, vascular, and structural heart devices for the treatment of cardiovascular diseases; and diabetes care products, as well as neuromodulation devices for the management of chronic pain and movement disorders. The company was founded in 1888 and is based in North Chicago, Illinois.</p></section>]"
ABBV,"[<section class=""quote-sub-section Mt(30px)"" data-reactid=""214""><h2 class=""Fz(m) Lh(1) Fw(b) Mt(0) Mb(18px)"" data-reactid=""215""><span data-reactid=""216"">Description</span></h2><p class=""Mt(15px) Lh(1.6)"" data-reactid=""217"">AbbVie Inc. discovers, develops, manufactures, and sells pharmaceuticals in the worldwide. The company offers HUMIRA, a therapy administered as an injection for autoimmune and intestinal Behçet's diseases; SKYRIZI to treat moderate to severe plaque psoriasis in adults; RINVOQ, a JAK inhibitor for the treatment of moderate to severe active rheumatoid arthritis in adult patients; IMBRUVICA to treat adult patients with chronic lymphocytic leukemia (CLL), small lymphocytic lymphoma (SLL), mantle cell lymphoma, waldenström's macroglobulinemia, marginal zone lymphoma, and chronic graft versus host disease; VENCLEXTA, a BCL-2 inhibitor used to treat adults with CLL or SLL; and MAVYRET to treat patients with chronic HCV genotype 1-6 infection. It also provides CREON, a pancreatic enzyme therapy for exocrine pancreatic insufficiency; Synthroid used in the treatment of hypothyroidism; AndroGel for males diagnosed with symptomatic low testosterone; Linzess/Constella to treat irritable bowel syndrome with constipation and chronic idiopathic constipation; Lupron for the palliative treatment of advanced prostate cancer, endometriosis and central precocious puberty, and patients with anemia caused by uterine fibroids; and Botox therapeutic. In addition, the company offers ORILISSA, a nonpeptide small molecule gonadotropin-releasing hormone antagonist for women with moderate to severe endometriosis pain; Duopa and Duodopa, a levodopa-carbidopa intestinal gel to treat Parkinson's disease; Lumigan/Ganfort, a bimatoprost ophthalmic solution for the reduction of elevated intraocular pressure (IOP) in patients with open angle glaucoma (OAG) or ocular hypertension; Ubrelvy to treat migraine with or without aura in adults; Alphagan/ Combigan, an alpha-adrenergic receptor agonist for the reduction of IOP in patients with OAG; and Restasis, a calcineurin inhibitor immunosuppressant to increase tear production. The company was incorporated in 2012 and is based in North Chicago, Illinois.</p></section>]"
ACN,"[<section class=""quote-sub-section Mt(30px)"" data-reactid=""216""><h2 class=""Fz(m) Lh(1) Fw(b) Mt(0) Mb(18px)"" data-reactid=""217""><span data-reactid=""218"">Description</span></h2><p class=""Mt(15px) Lh(1.6)"" data-reactid=""219"">Accenture plc, a professional services company, provides strategy and consulting, interactive, and technology and operations services worldwide. The company also provides outsourcing services. It serves communications, media, high tech, software, and platform companies; banking, capital market, and insurance industries; and consumer goods, retail, travel services, industrial, and life science industries, as well as clients in health, public service, chemicals and natural resources, energy, and utilities sectors. Accenture plc has alliance relationships with Adobe, Alibaba, Amazon Web Services, Blue Yonder, Cisco, Dell, Google, HPE, IBM RedHat, Microsoft, Oracle, Pegasystems, Salesforce, SAP, ServiceNow, VMWare, Workday, Massachusetts Institute of Technology, Institut Polytechnique de Paris, CNH Industrial, and Reactive Technologies. The company was incorporated in 2009 and is based in Dublin, Ireland.</p></section>]"
ATVI,"[<section class=""quote-sub-section Mt(30px)"" data-reactid=""214""><h2 class=""Fz(m) Lh(1) Fw(b) Mt(0) Mb(18px)"" data-reactid=""215""><span data-reactid=""216"">Description</span></h2><p class=""Mt(15px) Lh(1.6)"" data-reactid=""217"">Activision Blizzard, Inc., together with its subsidiaries, develops and publishes interactive entertainment content and services in the Americas, Europe, the Middle East, Africa, and the Asia Pacific. The company operates through three segments: Activision Publishing, Inc.; Blizzard Entertainment, Inc.; and King Digital Entertainment. It develops and distributes content and services on video game consoles, personal computers, and mobile devices, including subscription, full-game, and in-game sales, as well as by licensing software to third-party or related-party companies that distribute Activision and Blizzard products. The company also maintains a proprietary online gaming service, Battle.net that facilitates digital distribution of content, online social connectivity, and the creation of user-generated content. In addition, it operates esports leagues and offer digital advertising content; and provides warehousing, logistics, and sales distribution services to third-party publishers of interactive entertainment software, as well as manufacturers of interactive entertainment hardware products. The company's key product franchises include Call of Duty, World of Warcraft, Diablo, Hearthstone, Overwatch, and Candy Crush. It serves retailers and distributors, including mass-market retailers, consumer electronics stores, discount warehouses, and game specialty stores through third-party distribution and licensing arrangements. Activision Blizzard, Inc. is headquartered in Santa Monica, California.</p></section>]"
AYI,"[<section class=""quote-sub-section Mt(30px)"" data-reactid=""216""><h2 class=""Fz(m) Lh(1) Fw(b) Mt(0) Mb(18px)"" data-reactid=""217""><span data-reactid=""218"">Description</span></h2><p class=""Mt(15px) Lh(1.6)"" data-reactid=""219"">Acuity Brands, Inc. provides lighting and building management solutions and services for commercial, institutional, industrial, infrastructure, and residential applications in North America and internationally. The company offers lighting and control products and solutions, including recessed, surface, and suspended lighting; down, decorative, emergency and exit, track, day, special-use, street and roadway, parking garage, tunnel, underwater, area pedestrian, flood, decorative site, and landscape lighting; occupancy sensors; photo controls; relay panels; architectural dimming panels; and integrated lighting controls systems. It also provides building management systems, lighting, lighting controls, and location aware applications; and light emitting diode drivers, power supplies, modular wiring, sensors, glass, and inverters, as well as services across applications that primarily relate to monitoring and controlling lighting systems through network technologies and the commissioning of control systems. The company markets its products under the Lithonia Lighting, Holophane, Peerless, Gotham, Mark Architectural Lighting, Winona Lighting, Juno, Indy, Aculux, Healthcare Lighting, Hydrel, American Electric Lighting, Sunoptics, eldoLED, Distech Controls, nLight, ROAM, Sensor Switch, IOTA, A-light, Cyclone, Eureka, Luminaire LED, Luminis, Dark to Light, RELOC Wiring Solutions, DGLogik, and Atrius brands. It serves electrical distributors, retail home improvement centers, electric utilities, national accounts, system integrators, utility distributors, value-added resellers, digital retailers, government entities and municipalities, lighting showrooms, developers, original equipment manufacturers, and energy service companies, as well as the new construction, renovation, and maintenance and repair markets. Acuity Brands, Inc. was incorporated in 2001 and is headquartered in Atlanta, Georgia.</p></section>]"
ADBE,"[<section class=""quote-sub-section Mt(30px)"" data-reactid=""214""><h2 class=""Fz(m) Lh(1) Fw(b) Mt(0) Mb(18px)"" data-reactid=""215""><span data-reactid=""216"">Description</span></h2><p class=""Mt(15px) Lh(1.6)"" data-reactid=""217"">Adobe Inc. operates as a diversified software company worldwide. Its Digital Media segment provides tools and solutions that enable individuals, teams, and enterprises to create, publish, promote, and monetize their digital content. Its flagship product is Creative Cloud, a subscription service that allows customer to download and access the latest versions of its creative products. This segment serves content creators, experience designers, app developers, enthusiasts, students, social media users, and creative professionals; and marketing departments and agencies, companies, and publishers. The company's Digital Experience segment offers products, services, and solutions for creating, managing, executing, measuring, monetizing, and optimizing customer experiences from analytics to commerce. This segment serves marketers, advertisers, agencies, publishers, merchandisers, merchants, web analysts, data scientists, developers, marketing executives, information management and technology executives, product development executives, and sales and support executives. Its Publishing and Advertising segment offers products and services, such as e-learning solutions, technical document publishing, web conferencing, document and forms platform, web application development, and high-end printing, as well as publishing needs of technical and business, and original equipment manufacturers (OEMs) printing businesses. The company offers its products and services directly to enterprise customers through its sales force and local field offices, as well as to end users through app stores and through its website at adobe.com. It also distributes products and services through a network of distributors, value-added resellers, systems integrators, software vendors and developers, retailers, and OEMs. The company was formerly known as Adobe Systems Incorporated and changed its name to Adobe Inc. in October 2018. The company was founded in 1982 and is headquartered in San Jose, California.</p></section>]"
AAP,"[<section class=""quote-sub-section Mt(30px)"" data-reactid=""214""><h2 class=""Fz(m) Lh(1) Fw(b) Mt(0) Mb(18px)"" data-reactid=""215""><span data-reactid=""216"">Description</span></h2><p class=""Mt(15px) Lh(1.6)"" data-reactid=""217"">Advance Auto Parts, Inc. provides automotive replacement parts, accessories, batteries, and maintenance items for domestic and imported cars, vans, sport utility vehicles, and light and heavy duty trucks. The company offers battery accessories; belts and hoses; brakes and brake pads; chassis and climate control parts; clutches and drive shafts; engines and engine parts; exhaust systems and parts; hub assemblies; ignition components and wires; radiators and cooling parts; starters and alternators; and steering and alignment parts. It also offers air conditioning chemicals and accessories; air fresheners; antifreeze and washer fluids; electrical wires and fuses; electronics; floor mats, seat covers, and interior accessories; hand and specialty tools; lighting products; performance parts; sealants, adhesives and compounds; tire repair accessories; vent shades, mirrors and exterior accessories; washes, waxes and cleaning supplies; and wiper blades. In addition, the company offers air filters; fuel and oil additives; fuel filters; grease and lubricants; motor oils; oil filters, part cleaners and treatments; and transmission fluids for engine maintenance. Further, it offers battery and wiper installation; engine light scanning and checking; electrical system testing; video clinic; oil and battery recycling; and loaner tool program services. Additionally, the company sells its products through its Website. It serves professional installers and do-it-yourself customers. The company operates stores under the Advance Auto Parts, Autopart International, and Carquest brands, as well as branches under the Worldpac name. As of January 2, 2021, it operated 4,806 stores and 170 branches in the United States, Puerto Rico, the U.S. Virgin Islands, and Canada; and served 1,277 independently owned Carquest branded stores in Mexico, Grand Cayman, the Bahamas, Turks and Caicos, and the British Virgin Islands. The company was founded in 1929 and is based in Raleigh, North Carolina.</p></section>]"
AMD,"[<section class=""quote-sub-section Mt(30px)"" data-reactid=""214""><h2 class=""Fz(m) Lh(1) Fw(b) Mt(0) Mb(18px)"" data-reactid=""215""><span data-reactid=""216"">Description</span></h2><p class=""Mt(15px) Lh(1.6)"" data-reactid=""217"">Advanced Micro Devices, Inc. operates as a semiconductor company worldwide. The company operates in two segments, Computing and Graphics; and Enterprise, Embedded and Semi-Custom. Its products include x86 microprocessors as an accelerated processing unit, chipsets, discrete and integrated graphics processing units (GPUs), data center and professional GPUs, and development services; and server and embedded processors, and semi-custom System-on-Chip (SoC) products, development services, and technology for game consoles. The company provides x86 microprocessors for desktop PCs under the AMD Ryzen, AMD Ryzen PRO, Ryzen, Threadripper, AMD A-Series, AMD FX, AMD Athlon, AMD Athlon PRO, and AMD Pro A-Series processors brands; microprocessors for notebook and 2-in-1s under the AMD Ryzen, AMD A-Series, AMD Athlon, AMD Ryzen PRO, AMD Athlon PRO, and AMD Pro A-Series processors brands; microprocessors for servers under the AMD EPYC and AMD Opteron brands; and chipsets under the AMD trademark. It also offers discrete GPUs for desktop and notebook PCs under the AMD Radeon graphics and AMD Embedded Radeon brands; professional graphics products under the AMD Radeon Pro and AMD FirePro graphics brands; and Radeon Instinct and AMD Instinct accelerators for servers. In addition, the company provides embedded processor solutions under the AMD Opteron, AMD Athlon, AMD Geode, AMD Ryzen, AMD EPYC, AMD R-Series, and G-Series processors brands; and customer-specific solutions based on AMD CPU, GPU, and multi-media technologies, as well as semi-custom SoC products. It serves original equipment manufacturers, public cloud service providers, original design manufacturers, system integrators, independent distributors, online retailers, and add-in-board manufacturers through its direct sales force, independent distributors, and sales representatives. Advanced Micro Devices, Inc. was founded in 1969 and is headquartered in Santa Clara, California.</p></section>]"
AES,"[<section class=""quote-sub-section Mt(30px)"" data-reactid=""216""><h2 class=""Fz(m) Lh(1) Fw(b) Mt(0) Mb(18px)"" data-reactid=""217""><span data-reactid=""218"">Description</span></h2><p class=""Mt(15px) Lh(1.6)"" data-reactid=""219"">The AES Corporation operates as a diversified power generation and utility company. It owns and/or operates power plants to generate and sell power to customers, such as utilities, industrial users, and other intermediaries. The company also owns and/or operates utilities to generate or purchase, distribute, transmit, and sell electricity to end-user customers in the residential, commercial, industrial, and governmental sectors; and generates and sells electricity on the wholesale market. It uses a range of fuels and technologies to generate electricity, including natural gas, coal, pet coke, diesel, and oil, as well as renewables, such as hydro, solar, wind, energy storage, biomass, and landfill gas. The company owns and/or operates a generation portfolio of approximately 30,308 megawatts. It has operations in the United States, Puerto Rico, El Salvador, Chile, Colombia, Argentina, Brazil, Mexico, Central America, the Caribbean, Europe, and Asia. The company was formerly known as Applied Energy Services, Inc. and changed its name to The AES Corporation in April 2000. The AES Corporation was incorporated in 1981 and is headquartered in Arlington, Virginia.</p></section>]"
AET,[]
AMG,"[<section class=""quote-sub-section Mt(30px)"" data-reactid=""214""><h2 class=""Fz(m) Lh(1) Fw(b) Mt(0) Mb(18px)"" data-reactid=""215""><span data-reactid=""216"">Description</span></h2><p class=""Mt(15px) Lh(1.6)"" data-reactid=""217"">Affiliated Managers Group, Inc., through its affiliates, operates as an asset management company providing investment management services to mutual funds, institutional clients, and high net worth individuals in the United States. It provides advisory or subadvisory services to mutual funds. These funds are distributed to retail and institutional clients directly and through intermediaries, including independent investment advisors, retirement plan sponsors, broker-dealers, major fund marketplaces, and bank trust departments. The company also offers investment products in various investment styles in the institutional distribution channel, including small, small/mid, mid, and large capitalization value and growth equity, and emerging markets. In addition, it offers quantitative, alternative, and fixed income products, and manages assets for foundations and endowments, defined benefit, and defined contribution plans for corporations and municipalities. Affiliated Managers Group provides investment management or customized investment counseling and fiduciary services. The company was formed as a corporation under the laws of Delaware in 1993. Affiliated Managers Group is based in Prides Crossing, Massachusetts.</p></section>]"
AFL,"[<section class=""quote-sub-section Mt(30px)"" data-reactid=""214""><h2 class=""Fz(m) Lh(1) Fw(b) Mt(0) Mb(18px)"" data-reactid=""215""><span data-reactid=""216"">Description</span></h2><p class=""Mt(15px) Lh(1.6)"" data-reactid=""217"">Aflac Incorporated, through its subsidiaries, provides supplemental health and life insurance products. It operates through two segments, Aflac Japan and Aflac U.S. The Aflac Japan segment offers cancer, medical, income support, GIFT, and whole and term life insurance products, as well as WAYS and child endowment plans under saving type insurance products in Japan. The Aflac U.S. segment provides cancer, accident, short-term disability, critical care, hospital indemnity, dental, vision, long-term care and disability, and term and whole life insurance products in the United States. It sells its products through sales associates, brokers, independent corporate agencies, individual agencies, and affiliated corporate agencies. The company was founded in 1955 and is headquartered in Columbus, Georgia.</p></section>]"
