BSX,"[<section class=""quote-sub-section Mt(30px)"" data-reactid=""214""><h2 class=""Fz(m) Lh(1) Fw(b) Mt(0) Mb(18px)"" data-reactid=""215""><span data-reactid=""216"">Description</span></h2><p class=""Mt(15px) Lh(1.6)"" data-reactid=""217"">Boston Scientific Corporation develops, manufactures, and markets medical devices for use in various interventional medical specialties worldwide. It operates through three segments: MedSurg, Rhythm and Neuro, and Cardiovascular. The company offers devices to diagnose and treat gastrointestinal and pulmonary conditions; devices to treat various urological and pelvic conditions; implantable cardioverter and implantable cardiac resynchronization therapy defibrillators; pacemakers and implantable cardiac resynchronization therapy pacemakers; and remote patient management systems. It also provides medical technologies to diagnose and treat rate and rhythm disorders of the heart comprising 3-D cardiac mapping and navigation solutions, ablation catheters, diagnostic catheters, mapping catheters, intracardiac ultrasound catheters, delivery sheaths, and other accessories; spinal cord stimulator systems for the management of chronic pain; indirect decompression systems; and deep brain stimulation systems. In addition, the company offers interventional cardiology products, including drug-eluting coronary stent systems used in the treatment of coronary artery disease; percutaneous coronary interventions products to treat atherosclerosis; intravascular catheter-directed ultrasound imaging catheters, fractional flow reserve devices, and systems for use in coronary arteries and heart chambers, as well as various peripheral vessels; and structural heart therapies. Further, it provides stents, balloon catheters, wires, atherectomy systems to treat arterial diseases; thrombectomy and acoustic pulse thrombolysis systems, wires, and stents to treat venous diseases; and peripheral embolization devices, radioactive microspheres, ablation systems, and micro and drainage catheters to treat cancer. The company was founded in 1979 and is headquartered in Marlborough, Massachusetts.</p></section>]"
BHF,"[<section class=""quote-sub-section Mt(30px)"" data-reactid=""214""><h2 class=""Fz(m) Lh(1) Fw(b) Mt(0) Mb(18px)"" data-reactid=""215""><span data-reactid=""216"">Description</span></h2><p class=""Mt(15px) Lh(1.6)"" data-reactid=""217"">Brighthouse Financial, Inc. provides annuity and life insurance products in the United States. It operates through three segments: Annuities, Life, and Run-off. The Annuities segment offers variable, fixed, index-linked, and income annuities for contract holders' needs for protected wealth accumulation on a tax-deferred basis, wealth transfer, and income security. The Life segment provides term, universal, whole, and variable life policies for policyholders' needs for financial security and protected wealth transfer. The Run-off segment manages structured settlements, pension risk transfer contracts, certain company-owned life insurance policies, funding agreements, and universal life with secondary guarantees. The company was founded in 2016 and is headquartered in Charlotte, North Carolina.</p></section>]"
BMY,"[<section class=""quote-sub-section Mt(30px)"" data-reactid=""216""><h2 class=""Fz(m) Lh(1) Fw(b) Mt(0) Mb(18px)"" data-reactid=""217""><span data-reactid=""218"">Description</span></h2><p class=""Mt(15px) Lh(1.6)"" data-reactid=""219"">Bristol-Myers Squibb Company discovers, develops, licenses, manufactures, and markets biopharmaceutical products worldwide. The company offers products in hematology, oncology, cardiovascular, and immunology therapeutic classes. Its products include Revlimid, an oral immunomodulatory drug for the treatment of multiple myeloma; Opdivo for anti-cancer indications; Eliquis, an oral inhibitor indicated for the reduction in risk of stroke/systemic embolism in NVAF, and for the treatment of DVT/PE; and Orencia for adult patients with active RA and psoriatic arthritis, as well as reducing signs and symptoms in pediatric patients with active polyarticular juvenile idiopathic arthritis. The company also provides Sprycel for the treatment of Philadelphia chromosome-positive chronic myeloid leukemia; Yervoy for the treatment of patients with unresectable or metastatic melanoma; Abraxane, a solvent-free protein-bound chemotherapy product; mpliciti for the treatment of multiple myeloma; and Reblozyl for the treatment of anemia in adult patients with beta thalassemia. In addition, it offers Onureg for the continued treatment of adult patients with AML; Zeposia to treat relapsing forms of multiple sclerosis; Vidaza for the treatment of myelodysplastic syndrome subtypes; Baraclude, an oral antiviral agent for the treatment of chronic hepatitis B; and Breyanzi, a CD19-directed genetically modified autologous T cell immunotherapy for the treatment of adult patients with relapsed or refractory large B-cell lymphoma. The company sells products to wholesalers, distributors, pharmacies, retailers, hospitals, clinics, and government agencies. It has collaboration agreements with Pfizer, Inc.; Otsuka Pharmaceutical Co., Ltd.; Ono Pharmaceutical Co., Ltd.; Nektar Therapeutics; AVEO Pharmaceuticals, Inc.; Huyabio; and DarwinHealth, Inc. The company was formerly known as Bristol-Myers Company. Bristol-Myers Squibb Company was founded in 1887 and is headquartered in New York, New York.</p></section>]"
AVGO,"[<section class=""quote-sub-section Mt(30px)"" data-reactid=""214""><h2 class=""Fz(m) Lh(1) Fw(b) Mt(0) Mb(18px)"" data-reactid=""215""><span data-reactid=""216"">Description</span></h2><p class=""Mt(15px) Lh(1.6)"" data-reactid=""217"">Broadcom Inc. designs, develops, and supplies semiconductor infrastructure software solutions. It offers semiconductor devices with a focus on complex digital and mixed signal complementary metal oxide semiconductor based devices and analog III-V based products worldwide. The company's infrastructure software solutions enable customers to plan, develop, automate, manage, and secure applications across mainframe, distributed, mobile, and cloud platforms. It operates through two segments, Semiconductor Solutions and Infrastructure Software. The company was incorporated in 2018 and is based in San Jose, California.</p></section>]"
BF.B,[]
CHRW,"[<section class=""quote-sub-section Mt(30px)"" data-reactid=""214""><h2 class=""Fz(m) Lh(1) Fw(b) Mt(0) Mb(18px)"" data-reactid=""215""><span data-reactid=""216"">Description</span></h2><p class=""Mt(15px) Lh(1.6)"" data-reactid=""217"">C.H. Robinson Worldwide, Inc., together with its subsidiaries, provides freight transportation services and logistics solutions to companies in various industries worldwide. The company operates through two segments, North American Surface Transportation and Global Forwarding. It offers transportation and logistics services, such as truckload; less than truckload transportation, which include the shipment of single or multiple pallets of freight; intermodal transportation that include the shipment service of freight in trailers or containers by a combination of truck and rail; and non-vessel ocean common carrier and freight forwarding services, as well as organizes air shipments and offers door-to-door services. The company also provides customs broker services; and other logistics services, including fee-based managed, warehousing, small parcel, and other services. It has contractual relationships with approximately 73,000 transportation companies, including motor carriers, railroads, and air and ocean carriers. In addition, the company is involved in buying, selling, and marketing of fresh produce, including fresh fruits, vegetables, and other perishable items under the Robinson Fresh name. Further, it provides transportation management services or managed TMS; and other surface transportation services. The company offers its fresh produce to grocery retailers, restaurants, produce wholesalers, and foodservice distributors through a network of independent produce growers and suppliers. C.H. Robinson Worldwide, Inc. was founded in 1905 and is headquartered in Eden Prairie, Minnesota.</p></section>]"
CA,[]
COG,"[<section class=""quote-sub-section Mt(30px)"" data-reactid=""216""><h2 class=""Fz(m) Lh(1) Fw(b) Mt(0) Mb(18px)"" data-reactid=""217""><span data-reactid=""218"">Description</span></h2><p class=""Mt(15px) Lh(1.6)"" data-reactid=""219"">Cabot Oil &amp; Gas Corporation, an independent oil and gas company, explores for, exploits, develops, produces, and markets oil and gas properties in the United States. It primarily focuses on the Marcellus Shale with approximately 175,000 net acres in the dry gas window of the play located in Susquehanna County, Pennsylvania. The company sells its natural gas to industrial customers, local distribution companies, gas marketers, and power generation facilities through gathering systems and pipelines. As of December 31, 2020, it had proved reserves of approximately 13,672 billion cubic feet of gas; and 15 thousand barrels of oil or other liquid hydrocarbons. Cabot Oil &amp; Gas Corporation was incorporated in 1989 and is headquartered in Houston, Texas.</p></section>]"
CDNS,"[<section class=""quote-sub-section Mt(30px)"" data-reactid=""216""><h2 class=""Fz(m) Lh(1) Fw(b) Mt(0) Mb(18px)"" data-reactid=""217""><span data-reactid=""218"">Description</span></h2><p class=""Mt(15px) Lh(1.6)"" data-reactid=""219"">Cadence Design Systems, Inc. provides software, hardware, services, and reusable integrated circuit (IC) design blocks worldwide. The company offers functional verification services, including emulation and prototyping hardware. Its functional verification offering consists of JasperGold, a formal verification platform; Xcelium, a parallel logic simulation platform; Palladium, an enterprise emulation platform; and Protium, a prototyping platform for chip verification. The company also provides digital IC design products, including Genus logic synthesis and RTL power solutions, as well as Modus software solution to reduce systems-on-chip design-for-test time; physical implementation tools, including place and route, optimization, and multiple patterning preparation; and signoff products to signoff the design as ready for manufacture by a silicon foundry. In addition, it offers custom IC design and simulation products to create schematic and physical representations of circuits down to the transistor level for analog, mixed-signal, custom digital, memory, and radio frequency designs; and system design and analysis products to develop printed circuit boards and IC packages, as well as to analyze electromagnetic, electro-thermal, and other multi-physics effects. Further, the company provides intellectual property (IP) products consisting of pre-verified and customizable functional blocks to integrate into customer's ICs; and verification IP and memory models to verify the correct interaction with dozens of design IP interface protocols. Additionally, it offers services related to methodology, education, and hosted design solutions, as well as technical support and maintenance services. Cadence Design Systems, Inc. was incorporated in 1988 and is headquartered in San Jose, California.</p></section>]"
CPB,"[<section class=""quote-sub-section Mt(30px)"" data-reactid=""214""><h2 class=""Fz(m) Lh(1) Fw(b) Mt(0) Mb(18px)"" data-reactid=""215""><span data-reactid=""216"">Description</span></h2><p class=""Mt(15px) Lh(1.6)"" data-reactid=""217"">Campbell Soup Company, together with its subsidiaries, engages in the manufacture and market food and beverage products. It operates through Meals &amp; Beverages and Snacks segments. The Meals &amp; Beverages segment engages in the retail and foodservice businesses in the United States and Canada. This segment provides Campbell's condensed and ready-to-serve soups; Swanson broth and stocks; Pacific Foods broth, soups, and non-dairy beverages; Prego pasta sauces; Pace Mexican sauces; Campbell's gravies, pasta, beans, and dinner sauces; Swanson canned poultry; Plum baby food and snacks; V8 juices and beverages; V8 juices and beverages; and Campbell's tomato juice. The Snacks segment retails Pepperidge Farm cookies, crackers, fresh bakery, and frozen products in the United States; Milano cookies and Goldfish crackers; and Snyder's of Hanover pretzels, Lance sandwich crackers, Cape Cod and Kettle Brand potato chips, Late July snacks, Snack Factory Pretzel Crisps, Pop Secret popcorn, Emerald nuts, and other snacking products in the United States and Canada. This segment is also involved in the retail business in Latin America. The company sells its products through retail food chains, mass discounters and merchandisers, club stores, convenience stores, drug stores, and dollar stores, as well as e-commerce and other retail, commercial, and non-commercial establishments; and independent contractor distributors. Campbell Soup Company was founded in 1869 and is headquartered in Camden, New Jersey.</p></section>]"
COF,"[<section class=""quote-sub-section Mt(30px)"" data-reactid=""214""><h2 class=""Fz(m) Lh(1) Fw(b) Mt(0) Mb(18px)"" data-reactid=""215""><span data-reactid=""216"">Description</span></h2><p class=""Mt(15px) Lh(1.6)"" data-reactid=""217"">Capital One Financial Corporation operates as the financial services holding company for the Capital One Bank (USA), National Association; and Capital One, National Association, which provides various financial products and services in the United States, Canada, and the United Kingdom. It operates through three segments: Credit Card, Consumer Banking, and Commercial Banking. The company accepts checking accounts, money market deposits, negotiable order of withdrawals, savings deposits, and time deposits. Its loan products include credit card loans; auto and retail banking loans; and commercial and multifamily real estate, and commercial and industrial loans. The company also offers credit and debit card products; online direct banking services; and treasury management and depository services. It serves consumers, small businesses, and commercial clients through digital channels, branches, cafés, and other distribution channels located in New York, Louisiana, Texas, Maryland, Virginia, New Jersey, and California. Capital One Financial Corporation was founded in 1988 and is headquartered in McLean, Virginia.</p></section>]"
CAH,"[<section class=""quote-sub-section Mt(30px)"" data-reactid=""214""><h2 class=""Fz(m) Lh(1) Fw(b) Mt(0) Mb(18px)"" data-reactid=""215""><span data-reactid=""216"">Description</span></h2><p class=""Mt(15px) Lh(1.6)"" data-reactid=""217"">Cardinal Health, Inc. operates as an integrated healthcare services and products company in the United States and internationally. It provides customized solutions for hospitals, healthcare systems, pharmacies, ambulatory surgery centers, clinical laboratories, and physician offices. The company operates through two segments, Pharmaceutical and Medical. The Pharmaceutical segment distributes branded and generic pharmaceutical, specialty pharmaceutical, and over-the-counter healthcare and consumer products. It also provides services to pharmaceutical manufacturers and healthcare providers for specialty pharmaceutical products; operates nuclear pharmacies and radiopharmaceutical manufacturing facilities; and offers pharmacy management services to hospitals, as well as medication therapy management and patient outcomes services to hospitals, other healthcare providers, and payers. In addition, this segment repackages generic pharmaceuticals and over-the-counter healthcare products. The Medical segment manufactures, sources, and distributes Cardinal Health branded medical, surgical, and laboratory products. It also provides incontinence, nutritional delivery, wound care, cardiovascular, and endovascular products; single-use surgical drapes, gowns and apparel, and fluid suction and collection systems; urology products; operating room supplies; and electrode products. In addition, this segment distributes a range of national brand products, including medical, surgical, and laboratory products; and provides supply chain services and solutions to hospitals, ambulatory surgery centers, clinical laboratories, and other healthcare providers. Cardinal Health, Inc. was founded in 1979 and is headquartered in Dublin, Ohio.</p></section>]"
KMX,"[<section class=""quote-sub-section Mt(30px)"" data-reactid=""214""><h2 class=""Fz(m) Lh(1) Fw(b) Mt(0) Mb(18px)"" data-reactid=""215""><span data-reactid=""216"">Description</span></h2><p class=""Mt(15px) Lh(1.6)"" data-reactid=""217"">CarMax, Inc., through its subsidiaries, operates as a retailer of used vehicles in the United States. The company operates in two segments, CarMax Sales Operations and CarMax Auto Finance. It offers customers a range of makes and models of used vehicles, including domestic, imported, and luxury vehicles; and extended protection plans to customers at the time of sale, as well as sells vehicles that are approximately 10 years old and has more than 100,000 miles through whole auctions. The company also provides reconditioning and vehicle repair services; and financing alternatives for retail customers across a range of credit spectrum through its CarMax Auto Finance and arrangements with various financial institutions. As of February 28, 2021, it operated approximately 220 used car stores and 1 new car franchises. CarMax, Inc. was founded in 1993 and is based in Richmond, Virginia.</p></section>]"
CCL,"[<section class=""quote-sub-section Mt(30px)"" data-reactid=""216""><h2 class=""Fz(m) Lh(1) Fw(b) Mt(0) Mb(18px)"" data-reactid=""217""><span data-reactid=""218"">Description</span></h2><p class=""Mt(15px) Lh(1.6)"" data-reactid=""219"">Carnival Corporation &amp; plc operates as a leisure travel company. Its ships visit approximately 700 ports under the Carnival Cruise Line, Princess Cruises, Holland America Line, P&amp;O Cruises (Australia), Seabourn, Costa Cruises, AIDA Cruises, P&amp;O Cruises (UK), and Cunard brand names. The company also provides port destinations and other services, as well as owns and operates hotels, lodges, glass-domed railcars, and motor coaches. It sells its cruises primarily through travel agents and tour operators. The company operates in the United States, Canada, Continental Europe, the United Kingdom, Australia, New Zealand, Asia, and internationally. It operates 87 ships with 223,000 lower berths. The company was incorporated in 1972 and is headquartered in Miami, Florida.</p></section>]"
CAT,"[<section class=""quote-sub-section Mt(30px)"" data-reactid=""216""><h2 class=""Fz(m) Lh(1) Fw(b) Mt(0) Mb(18px)"" data-reactid=""217""><span data-reactid=""218"">Description</span></h2><p class=""Mt(15px) Lh(1.6)"" data-reactid=""219"">Caterpillar Inc. manufactures and sells construction and mining equipment, diesel and natural gas engines, industrial gas turbines, and diesel-electric locomotives worldwide. Its Construction Industries segment offers asphalt pavers, compactors, cold planers, motorgraders, pipelayers, road reclaimers, telehandlers, and utility vehicles; backhoe, compact track, multi-terrain, skid steer, and track-type loaders; forestry and wheel excavators; and site prep and track-type tractors. The company's Resource Industries segment provides electric rope and hydraulic shovels, draglines, rotary drills, hard rock vehicles, track-type tractors, mining trucks, longwall miners, wheel loaders, off-highway and articulated trucks, wheel tractor scrapers, wheel dozers, landfill and soil compactors, machinery components, autonomous ready vehicles and solutions, and select work tools. Its Energy &amp; Transportation segment offers reciprocating engine powered generator sets; reciprocating engines and integrated systems for the power generation, marine, oil, and gas industries; turbines, centrifugal gas compressors, and related services; remanufactured reciprocating engines and components; and diesel-electric locomotives and components, and other rail-related products. The company's Financial Products segment provides operating and finance leases, installment sale contracts, working capital loans, and wholesale financing; and insurance and risk management, as well as other equipment-related loans. Its All Other Operating segment offers filters and fluids, undercarriage, ground engaging tools, fluid transfer products, precision seals, and rubber sealing and connecting components; parts distribution; integrated logistics solutions; portfolio management; brand management and marketing strategy; and digital investments services. The company was formerly known as Caterpillar Tractor Co. The company was founded in 1925 and is headquartered in Deerfield, Illinois.</p></section>]"
CBOE,"[<section class=""quote-sub-section Mt(30px)"" data-reactid=""214""><h2 class=""Fz(m) Lh(1) Fw(b) Mt(0) Mb(18px)"" data-reactid=""215""><span data-reactid=""216"">Description</span></h2><p class=""Mt(15px) Lh(1.6)"" data-reactid=""217"">Cboe Global Markets, Inc., through its subsidiaries, operates as an options exchange worldwide. It operates through five segments: Options, North American Equities, Futures, European Equities, and Global FX. The Options segment trades in listed market indices. The North American Equities segment trades in listed U.S. and Canadian equities; and offers exchange-traded products (ETP) transaction and ETP listing services. The Futures segment trades in futures. The European Equities segment offers pan-European listed equities transaction services, ETPs, exchange-traded commodities, and international depository receipts, as well as ETP listings and clearing services. The Global FX segment provides institutional foreign exchange (FX) trading and non-deliverable forward FX transactions services. The company has strategic relationships with S&amp;P Dow Jones Indices, LLC; FTSE International Limited; Frank Russell Company; MSCI Inc.; and DJI Opco, LLC. The company was formerly known as CBOE Holdings, Inc. and changed its name to Cboe Global Markets, Inc. in October 2017. Cboe Global Markets, Inc. was founded in 1973 and is headquartered in Chicago, Illinois.</p></section>]"
CBG,[]
CBS,[]
CELG,[]
CNC,"[<section class=""quote-sub-section Mt(30px)"" data-reactid=""216""><h2 class=""Fz(m) Lh(1) Fw(b) Mt(0) Mb(18px)"" data-reactid=""217""><span data-reactid=""218"">Description</span></h2><p class=""Mt(15px) Lh(1.6)"" data-reactid=""219"">Centene Corporation operates as a multi-national healthcare enterprise that provides programs and services to under-insured and uninsured individuals in the United States. Its Managed Care segment offers health plan coverage to individuals through government subsidized programs, including Medicaid, the State children's health insurance program, long-term services and support, foster care, and medicare-medicaid plans, which cover dually eligible individuals, as well as aged, blind, or disabled programs. Its health plans include primary and specialty physician care, inpatient and outpatient hospital care, emergency and urgent care, prenatal care, laboratory and X-ray, home-based primary care, transportation assistance, vision care, dental care, telehealth, immunization, specialty pharmacy, therapy, social work, nurse advisory, and care coordination services, as well as prescriptions and limited over-the-counter drugs, medical equipment, and behavioral health and abuse services. This segment also offers various individual, small group, and large group commercial healthcare products to employers and directly to members in the Managed Care segment. The company's Specialty Services segment provides pharmacy benefits management services; nurse advice line and after-hours support services; and vision and dental services, as well as staffing services to correctional systems and other government agencies; and services to Military Health System eligible beneficiaries. This segment offers its services and products to state programs, correctional facilities, healthcare organizations, employer groups, and other commercial organizations. The company provides its services through primary and specialty care physicians, hospitals, and ancillary providers. Centene Corporation was founded in 1984 and is headquartered in St. Louis, Missouri.</p></section>]"
