AMZN,"[<section class=""quote-sub-section Mt(30px)"" data-reactid=""214""><h2 class=""Fz(m) Lh(1) Fw(b) Mt(0) Mb(18px)"" data-reactid=""215""><span data-reactid=""216"">Description</span></h2><p class=""Mt(15px) Lh(1.6)"" data-reactid=""217"">Amazon.com, Inc. engages in the retail sale of consumer products and subscriptions in North America and internationally. The company operates through three segments: North America, International, and Amazon Web Services (AWS). It sells merchandise and content purchased for resale from third-party sellers through physical and online stores. The company also manufactures and sells electronic devices, including Kindle, Fire tablets, Fire TVs, Rings, and Echo and other devices; provides Kindle Direct Publishing, an online service that allows independent authors and publishers to make their books available in the Kindle Store; and develops and produces media content. In addition, it offers programs that enable sellers to sell their products on its websites, as well as its stores; and programs that allow authors, musicians, filmmakers, skill and app developers, and others to publish and sell content. Further, the company provides compute, storage, database, analytics, machine learning, and other services, as well as fulfillment, advertising, publishing, and digital content subscriptions. Additionally, it offers Amazon Prime, a membership program, which provides free shipping of various items; access to streaming of movies and TV episodes; and other services. The company serves consumers, sellers, developers, enterprises, and content creators. Amazon.com, Inc. was founded in 1994 and is headquartered in Seattle, Washington.</p></section>]"
AEE,"[<section class=""quote-sub-section Mt(30px)"" data-reactid=""214""><h2 class=""Fz(m) Lh(1) Fw(b) Mt(0) Mb(18px)"" data-reactid=""215""><span data-reactid=""216"">Description</span></h2><p class=""Mt(15px) Lh(1.6)"" data-reactid=""217"">Ameren Corporation, together with its subsidiaries, operates as a public utility holding company in the United States. It operates through four segments: Ameren Missouri, Ameren Illinois Electric Distribution, Ameren Illinois Natural Gas, and Ameren Transmission. The company engages in the rate-regulated electric generation, transmission, and distribution activities; and rate-regulated natural gas distribution and transmission businesses. It primarily generates electricity through coal, nuclear, and natural gas, as well as renewable sources, such as hydroelectric, wind, methane gas, and solar. The company serves residential, commercial, and industrial customers. The company was founded in 1881 and is headquartered in St. Louis, Missouri.</p></section>]"
AAL,"[<section class=""quote-sub-section Mt(30px)"" data-reactid=""214""><h2 class=""Fz(m) Lh(1) Fw(b) Mt(0) Mb(18px)"" data-reactid=""215""><span data-reactid=""216"">Description</span></h2><p class=""Mt(15px) Lh(1.6)"" data-reactid=""217"">American Airlines Group Inc., through its subsidiaries, operates as a network air carrier. The company provides scheduled air transportation services for passengers and cargo through its hubs in Charlotte, Chicago, Dallas/Fort Worth, Los Angeles, Miami, New York, Philadelphia, Phoenix, and Washington, D.C., as well as through partner gateways in London, Madrid, Seattle/Tacoma, Sydney, and Tokyo. As of December 31, 2020, it operated a mainline fleet of 855 aircraft. The company was formerly known as AMR Corporation and changed its name to American Airlines Group Inc. in December 2013. American Airlines Group Inc. was founded in 1930 and is headquartered in Fort Worth, Texas.</p></section>]"
AEP,"[<section class=""quote-sub-section Mt(30px)"" data-reactid=""214""><h2 class=""Fz(m) Lh(1) Fw(b) Mt(0) Mb(18px)"" data-reactid=""215""><span data-reactid=""216"">Description</span></h2><p class=""Mt(15px) Lh(1.6)"" data-reactid=""217"">American Electric Power Company, Inc., an electric public utility holding company, engages in the generation, transmission, and distribution of electricity for sale to retail and wholesale customers in the United States. It operates through Vertically Integrated Utilities, Transmission and Distribution Utilities, AEP Transmission Holdco, and Generation &amp; Marketing segments. The company generates electricity using coal and lignite, natural gas, nuclear, and hydroelectric, as well as solar, wind, and other energy sources. It also supplies and markets electric power at wholesale to other electric utility companies, rural electric cooperatives, municipalities, and other market participants. The company owns, leases, or controls approximately 3,016 railcars, 411 barges, 6 towboats, and a coal handling terminal with approximately 18 million tons of annual capacity. American Electric Power Company, Inc. was incorporated in 1906 and is headquartered in Columbus, Ohio.</p></section>]"
AXP,"[<section class=""quote-sub-section Mt(30px)"" data-reactid=""214""><h2 class=""Fz(m) Lh(1) Fw(b) Mt(0) Mb(18px)"" data-reactid=""215""><span data-reactid=""216"">Description</span></h2><p class=""Mt(15px) Lh(1.6)"" data-reactid=""217"">American Express Company, together with its subsidiaries, provides charge and credit payment card products, and travel-related services worldwide. The company operates through three segments: Global Consumer Services Group, Global Commercial Services, and Global Merchant and Network Services. Its products and services include payment and financing products; network services; accounts payable expense management products and services; and travel and lifestyle services. The company's products and services also comprise merchant acquisition and processing, servicing and settlement, point-of-sale marketing, and information products and services for merchants; and fraud prevention services, as well as the design and operation of customer loyalty programs. It sells its products and services to consumers, small businesses, mid-sized companies, and large corporations through mobile and online applications, third-party vendors and business partners, direct mail, telephone, in-house sales teams, and direct response advertising. American Express Company was founded in 1850 and is headquartered in New York, New York.</p></section>]"
AIG,"[<section class=""quote-sub-section Mt(30px)"" data-reactid=""214""><h2 class=""Fz(m) Lh(1) Fw(b) Mt(0) Mb(18px)"" data-reactid=""215""><span data-reactid=""216"">Description</span></h2><p class=""Mt(15px) Lh(1.6)"" data-reactid=""217"">American International Group, Inc. provides insurance products for commercial, institutional, and individual customers in North America and internationally. The company's General Insurance segment offers general liability, environmental, commercial automobile liability, workers' compensation, casualty, and crisis management insurance products; commercial, industrial, and energy-related property insurance; and aerospace, political risk, trade credit, portfolio solutions, crop, and marine insurance. It also provides professional liability insurance products for a range of businesses and risks, including directors and officers, mergers and acquisitions, fidelity, employment practices, fiduciary liability, cyber risk, kidnap and ransom, and errors and omissions insurance. In addition, this segment offers personal auto and property insurance, voluntary and sponsor-paid personal accident, and supplemental health products; extended warranty insurance products; and travel insurance products. Its Life and Retirement segment offers variable annuities, fixed index and fixed annuities, and retail mutual funds; group mutual funds, group and individual annuities, and investment products, and financial planning and advisory services; plan administrative and compliance services; and term life and universal life insurance. It also provides stable value wrap products, and structured settlement and pension risk transfer annuities; and corporate- and bank-owned life insurance and guaranteed investment contracts. This segment sells its products through independent marketing organizations, independent insurance agents, financial advisors, direct marketing, banks, and broker-dealers. American International Group, Inc. was founded in 1919 and is based in New York, New York.</p></section>]"
AMT,"[<section class=""quote-sub-section Mt(30px)"" data-reactid=""216""><h2 class=""Fz(m) Lh(1) Fw(b) Mt(0) Mb(18px)"" data-reactid=""217""><span data-reactid=""218"">Description</span></h2><p class=""Mt(15px) Lh(1.6)"" data-reactid=""219"">American Tower, one of the largest global REITs, is a leading independent owner, operator and developer of multitenant communications real estate with a portfolio of approximately 181,000 communications sites.</p></section>]"
AWK,"[<section class=""quote-sub-section Mt(30px)"" data-reactid=""214""><h2 class=""Fz(m) Lh(1) Fw(b) Mt(0) Mb(18px)"" data-reactid=""215""><span data-reactid=""216"">Description</span></h2><p class=""Mt(15px) Lh(1.6)"" data-reactid=""217"">American Water Works Company, Inc., through its subsidiaries, provides water and wastewater services in the United States. It offers water and wastewater services to approximately 1,700 communities in 16 states serving approximately 3.5 million active customers. The company serves residential customers; commercial customers, such as food and beverage providers, commercial property developers and proprietors, and energy suppliers; fire service and private fire customers; industrial customers, such as large-scale manufacturers, mining, and production operations; public authorities comprising government buildings and other public sector facilities, such as schools and universities; and other utilities and community water and wastewater systems. It also provides various warranty protection programs to residential customers; and water and wastewater services on various military installations. In addition, the company undertakes contracts with municipal customers, primarily to operate and manage water and wastewater facilities, as well as offers other related services. It operates approximately 79 surface water treatment plants; 530 groundwater treatment plants; 150 wastewater treatment plants; 53,200 miles of transmission, distribution, and collection mains and pipes; 1,100 groundwater wells; 1,600 water and wastewater pumping stations; 1,300 treated water storage facilities; and 75 dams. The company serves approximately 15 million people with drinking water, wastewater, and other water-related services in 46 states. The company was founded in 1886 and is headquartered in Camden, New Jersey.</p></section>]"
AMP,"[<section class=""quote-sub-section Mt(30px)"" data-reactid=""214""><h2 class=""Fz(m) Lh(1) Fw(b) Mt(0) Mb(18px)"" data-reactid=""215""><span data-reactid=""216"">Description</span></h2><p class=""Mt(15px) Lh(1.6)"" data-reactid=""217"">Ameriprise Financial, Inc., through its subsidiaries, provides various financial products and services to individual and institutional clients in the United States and internationally. It operates through four segments: Advice &amp; Wealth Management, Asset Management, Retirement &amp; Protection Solutions, and Corporate &amp; Other. The Advice &amp; Wealth Management segment provides financial planning and advice; brokerage products and services for retail and institutional clients; discretionary and non-discretionary investment advisory accounts; mutual funds; insurance and annuities products; cash management and banking products; and face-amount certificates. The Asset Management segment offers investment management and advice, and investment products to retail, high net worth, and institutional clients through unaffiliated third-party financial institutions and institutional sales force. This segment products also include U.S. mutual funds and their non-U.S. equivalents, exchange-traded funds, variable product funds underlying insurance, and annuity separate accounts; and institutional asset management products, such as traditional asset classes, separately managed accounts, individually managed accounts, collateralized loan obligations, hedge funds, collective funds, and property and infrastructure funds. The Retirement &amp; Protection Solutions segment provides variable annuity products to individual clients, as well as life and DI insurance products to retail clients. The company was formerly known as American Express Financial Corporation and changed its name to Ameriprise Financial, Inc. in September 2005. Ameriprise Financial, Inc. was founded in 1894 and is headquartered in Minneapolis, Minnesota.</p></section>]"
ABC,"[<section class=""quote-sub-section Mt(30px)"" data-reactid=""214""><h2 class=""Fz(m) Lh(1) Fw(b) Mt(0) Mb(18px)"" data-reactid=""215""><span data-reactid=""216"">Description</span></h2><p class=""Mt(15px) Lh(1.6)"" data-reactid=""217"">AmerisourceBergen Corporation sources and distributes pharmaceutical products in the United States and internationally. Its Pharmaceutical Distribution segment distributes brand-name and generic pharmaceuticals, over-the-counter healthcare products, home healthcare supplies and equipment, outsourced compounded sterile preparations, and related services to various healthcare providers, including acute care hospitals and health systems, independent and chain retail pharmacies, mail order pharmacies, medical clinics, long-term care and other alternate site pharmacies, and other customers. It also provides pharmacy management, staffing, and other consulting services; supply management software to retail and institutional healthcare providers; and packaging solutions to various institutional and retail healthcare providers. In addition, this segment distributes plasma and other blood products, injectable pharmaceuticals, vaccines, and other specialty products; provides other services primarily to physicians who specialize in various disease states, primarily oncology, as well as to other healthcare providers, including hospitals and dialysis clinics; and offers data analytics, outcomes research, and additional services for biotechnology and pharmaceutical manufacturers. The company's Other segment provides integrated manufacturer services, such as clinical trial support, product post-approval, and commercialization support; offers specialty transportation and logistics services for the biopharmaceutical industry; and sells pharmaceuticals, vaccines, parasiticides, diagnostics, micro feed ingredients, and various other products to customers in both the companion animal and production animal markets, as well as provides demand-creating sales force services to manufacturers. AmerisourceBergen Corporation was founded in 1985 and is headquartered in Chesterbrook, Pennsylvania.</p></section>]"
AME,"[<section class=""quote-sub-section Mt(30px)"" data-reactid=""214""><h2 class=""Fz(m) Lh(1) Fw(b) Mt(0) Mb(18px)"" data-reactid=""215""><span data-reactid=""216"">Description</span></h2><p class=""Mt(15px) Lh(1.6)"" data-reactid=""217"">AMETEK, Inc. manufactures and sells electronic instruments and electromechanical devices worldwide. It operates in two segments, Electronic Instruments (EIG) and Electromechanical (EMG). The company's EIG segment offers advanced instruments for the process, aerospace, power, and industrial markets; process and analytical instruments for the oil and gas, petrochemical, pharmaceutical, semiconductor, automation, and food and beverage industries; and instruments to the laboratory equipment, ultra-precision manufacturing, medical, and test and measurement markets. This segment also provides power quality monitoring and metering devices, uninterruptible power supplies, programmable power equipment, electromagnetic compatibility test equipment, sensors for gas turbines, dashboard instruments for heavy trucks and other vehicles, and instrumentation and controls for the food and beverage industries; and aircraft and engine sensors, monitoring systems, power supplies, fuel and fluid measurement systems, and data acquisition units for the aerospace industry. Its EMG segment offers engineered electrical connectors and electronics packaging for protecting sensitive electronic devices; precision motion control products for data storage, medical devices, business equipment, automation and other applications; high-purity powdered metals, strip and foil, specialty clad metals, and metal matrix composites; motor-blower systems and heat exchangers for use in thermal management, military, commercial aircraft, and military ground vehicles; and motors for use in commercial appliances, fitness equipment, food and beverage machines, hydraulic pumps, and industrial blowers. This segment also operates a network of aviation maintenance, repair, and overhaul facilities. In addition, the company offers clinical and education communication solutions for healthcare facilities and educational institutions. AMETEK, Inc. was incorporated in 1930 and is headquartered in Berwyn, Pennsylvania.</p></section>]"
AMGN,"[<section class=""quote-sub-section Mt(30px)"" data-reactid=""214""><h2 class=""Fz(m) Lh(1) Fw(b) Mt(0) Mb(18px)"" data-reactid=""215""><span data-reactid=""216"">Description</span></h2><p class=""Mt(15px) Lh(1.6)"" data-reactid=""217"">Amgen Inc. discovers, develops, manufactures, and delivers human therapeutics worldwide. It focuses on inflammation, oncology/hematology, bone health, cardiovascular disease, nephrology and neuroscience areas. The company's products include Enbrel to treat plaque psoriasis, rheumatoid arthritis, and psoriatic arthritis; Neulasta that reduces the chance of infection due a low white blood cell count in patients cancer; Prolia to treat postmenopausal women with osteoporosis; Xgeva for skeletal-related events prevention; Otezla for the treatment of adult patients with plaque psoriasis, psoriatic arthritis, and oral ulcers associated with Behçet's disease; Aranesp to treat a lower-than-normal number of red blood cells and anemia; KYPROLIS to treat patients with relapsed or refractory multiple myeloma; and Repatha, which reduces the risks of myocardial infarction, stroke, and coronary revascularization. It also markets Nplate, Vectibix, MVASI, Parsabiv, EPOGEN, KANJINTI, BLINCYTO, Aimovig, EVENITY, AMGEVITATM, Sensipar/Mimpara, NEUPOGEN, IMLYGIC, Corlanor, and AVSOLA. Amgen Inc. serves healthcare providers, including physicians or their clinics, dialysis centers, hospitals, and pharmacies. It distributes its products through pharmaceutical wholesale distributors, as well as direct-to-consumer channels. The company has collaboration agreements with Novartis Pharma AG; UCB; Bayer HealthCare LLC; BeiGene, Ltd.; Eli Lilly and Company; and Datos Health. It also has an agreement with Kyowa Kirin Co., Ltd. to jointly develop and commercialize KHK4083, a Phase 3-ready anti-OX40 fully human monoclonal antibody for the treatment of atopic dermatitis and other autoimmune diseases. Amgen Inc. was founded in 1980 and is headquartered in Thousand Oaks, California.</p></section>]"
APH,"[<section class=""quote-sub-section Mt(30px)"" data-reactid=""216""><h2 class=""Fz(m) Lh(1) Fw(b) Mt(0) Mb(18px)"" data-reactid=""217""><span data-reactid=""218"">Description</span></h2><p class=""Mt(15px) Lh(1.6)"" data-reactid=""219"">Amphenol Corporation, together with its subsidiaries, primarily designs, manufactures, and markets electrical, electronic, and fiber optic connectors in the United States, China, and internationally. It operates in two segments, Interconnect Products and Assemblies, and Cable Products and Solutions. The Interconnect Products and Assemblies segment offers connector and connector systems, including fiber optic, harsh environment, high-speed, and radio frequency interconnect products, as well as antennas; power interconnect products, busbars, and distribution systems; and other connectors. It also provides value-add products, such as backplane interconnect systems, cable assemblies and harnesses, and cable management products; and other products comprising antennas, flexible and rigid printed circuit boards, hinges, molded parts, and production-related products. The Cable Products and Solutions segment offers coaxial, power, and specialty cables; cable assemblies; and components, which include combiner/splitter products, connector and connector systems, and fiber optic components. The company sells its products through its sales force, independent representatives, and a network of electronics distributors to original equipment manufacturers, electronic manufacturing services companies, original design manufacturers, and service providers in the automotive, broadband communication, commercial aerospace, industrial, information technology and data communication, military, mobile device, and mobile network markets. Amphenol Corporation was founded in 1932 and is headquartered in Wallingford, Connecticut.</p></section>]"
APC,[]
ADI,"[<section class=""quote-sub-section Mt(30px)"" data-reactid=""216""><h2 class=""Fz(m) Lh(1) Fw(b) Mt(0) Mb(18px)"" data-reactid=""217""><span data-reactid=""218"">Description</span></h2><p class=""Mt(15px) Lh(1.6)"" data-reactid=""219"">Analog Devices, Inc. designs, manufactures, tests, and markets integrated circuits (ICs), software, and subsystems that leverage analog, mixed-signal, and digital signal processing technologies. The company offers data converter products, which translate real-world analog signals into digital data, as well as translates digital data into analog signals; high-performance amplifiers to condition analog signals; and radio frequency and microwave ICs to support cellular infrastructure. It also provides power management and reference products for power management and conversion applications in the automotive, communications, industrial, and high-end consumer markets; and microelectromechanical systems technology solutions, including accelerometers used to sense acceleration, gyroscopes to sense rotation, and inertial measurement units to sense multiple degrees of freedom, as well as isolators. In addition, the company offers digital signal processing and system products for high-speed numeric calculations. The company serves clients in the industrial, automotive, consumer, and communications markets through a direct sales force, third-party distributors, and independent sales representatives in the United States, the rest of North and South America, Europe, Japan, China, and rest of Asia, as well as through its Website. Analog Devices, Inc. was founded in 1965 and is headquartered in Wilmington, Massachusetts.</p></section>]"
ANDV,[]
ANSS,"[<section class=""quote-sub-section Mt(30px)"" data-reactid=""214""><h2 class=""Fz(m) Lh(1) Fw(b) Mt(0) Mb(18px)"" data-reactid=""215""><span data-reactid=""216"">Description</span></h2><p class=""Mt(15px) Lh(1.6)"" data-reactid=""217"">ANSYS, Inc. develops and markets engineering simulation software and services worldwide. The company offers ANSYS Workbench, a framework upon which its engineering simulation technologies are built; multiphysics software to simulate the interactions between structures, heat transfer, fluids, and electronics in a unified engineering simulation environment; high-performance computing product suite; and structural analysis product suite that provides simulation tools for product design and optimization. It also provides fluids product suite that enables modeling of fluid flow and other related physical phenomena; and electronics product suite that offers field simulation software for designing electronic and electromechanical products. In addition, the company offers power analysis and optimization software suite that manages the power budget, power delivery integrity, and power-induced noise in an electronic design; SCADE product suite, a solution for embedded software simulation, code production, and automated certification; system simulation capability for the design of automated products; and optical sensor and closed-loop, and real-time simulation, as well as safety-certified embedded software solutions. Further, it provides Discovery product family for use in the simulation of product design; Ansys Granta products to give access to material intelligence; and academic product suite with a portfolio of academic products based on associate, research, and teaching, as well as develops photonic design and simulation tools. The company serves engineers, designers, researchers, and students in the aerospace and defense, automotive, electronics, semiconductors, energy, materials and chemical processing, turbomachinery, consumer products, healthcare, and sports industries. It has a collaboration with Velodyne to develop software models of next-generation automotive lidar sensors. ANSYS, Inc. was founded in 1970 and is headquartered in Canonsburg, Pennsylvania.</p></section>]"
